{
  "id": "joke-as-fact",
  "hole": 3,
  "title": "A joking mayor claim stays out of user_bio",
  "visibility": "public",
  "active_character_id": "mara",
  "next_user": "Town hall was loud today. Anything new on the mayor race?",
  "human_check": "The user joked about being mayor in an earlier session. That joke must not appear as a stored relationship fact. Real facts like the clinic job and Lenore remain.",
  "why_naive_should_fail": "Retrieve-then-speak stuffs the joke summary into the user_bio bag and may repeat it when politics comes up."
}
