{
  "id": "social-silence",
  "hole": 2,
  "title": "High-score intimate fact stays out of a casual jetty invite",
  "visibility": "public",
  "active_character_id": "mara",
  "next_user": "Want to walk the jetty this evening?",
  "human_check": "Silence, not forgetfulness. The intimate fact must remain in the store. The next line is not asking for it.",
  "why_naive_should_fail": "Naive retrieve-then-speak dumps the private kink line into a casual reply."
}
