{
  "id": "forget-that",
  "hole": 9,
  "title": "Revoked nickel allergy absent on the next dinner turn",
  "visibility": "public",
  "active_character_id": "mara",
  "next_user": "I'm making dinner tonight. Any ideas?",
  "human_check": "Forget-that is write-time revocation, not silent recall. Nickel must not appear in reply or active user_bio.",
  "why_naive_should_fail": "Naive bag still contains the allergy line from session history."
}
