{
  "id": "typed-retcon",
  "hole": 4,
  "title": "User job retcon supersedes; character boast and narrator tag stay typed",
  "visibility": "public",
  "active_character_id": "mara",
  "next_user": "Rough week. Still doing nights at the clinic?",
  "human_check": "User corrected their job to the maritime archive. Mara's ferry boast stays character_event. Narrator note tags the boast as bluster. Reply must not treat the clinic as current work.",
  "why_naive_should_fail": "Retrieve-then-speak keeps the old clinic line in the stuffed bag and treats it as current."
}
