{
  "id": "cross-character-leak",
  "hole": 5,
  "title": "Corin does not know the firing told only to Mara",
  "visibility": "public",
  "active_character_id": "corin",
  "next_user": "Have I seemed off to you lately?",
  "human_check": "This is isolation, not forgetfulness. Mara's store must still hold the firing. Corin's reply fails if it names Harbor Clinic, March 3, or the firing.",
  "why_naive_should_fail": "Naive is one user bag. Corin recites the firing because it is text about the user."
}
